"","text","text_tag","author","label"
"6068","ed gillespi paid frontman coalit made individu mandat centerpiec health reform plan","health care messag machin","kay grimsdale","0"
"4182"," scott walker enact biggest cut educ state histori","educ state budget state financ","drake sharer","1"
"7256","spend half trillion dollar year tax prepar","tax","rubina christian","0"
"2205"," conni mack iv co sponsor bill take third social secur trust fund give individu account senior citizen invest stock market","social secur","haily collecott","0"
"9690","texa democrat hispan elect offici republican parti","candid biographi divers elect histori","tamma priestman","1"
"3762","social secur advoc s way get peopl quit work thought confin perman scarciti job countri","economi histori poverti social secur worker","lothario de giorgi","0"
"2638","part legisl fight abort right mike coffman co sponsor bill redefin rape","abort correct updat crime crimin justic women","drud sharpus","1"
"5523","take credit rein state spend governor","job accomplish state budget","stacy clears","0"
"6724","demand public transport reach record level wisconsin","state budget transport","ginevra warre","0"
"9464","state countri can still get fire just gay employ think gay","gay lesbian legal issu state worker","nada monks","0"
"2287","mack penni plan feder budget balanc budget continu gain support","deficit feder budget","edgar cordelle","0"
"10057","sinc sept american kill gunfir home","gun pundit","reidar ninnoli","1"
"2580"," yet get respons barack obama august letter make border secur request","immigr","burgess tromans","0"
"5882","ive creat job","job accomplish job","betteann adney","0"
"754"," richard burr one three senat vote ban insid trade member congress call vote brave","congress congression rule ethic legal issu vote record","torin dowles","1"
"1254","ken block support obamacar","economi health care messag machin","ericka la vigne","0"
"10076","dalla african american hispan student pass ap exam higher rate place america","educ","emlynne chattelaine","0"
"9815"," russ feingold vote give social secur benefit illeg immigr","immigr messag machin","wilhelmina rubi","0"
"657","accus presid barack obama make contradictori claim effort kill osama bin laden","homeland secur militari terror","crawford precious","0"
"535","peopl hopeless sixti percent popul percent popul want live somewher els time left percent want stay","job accomplish","dallas sellman","0"
"7532"," conni mack fail pay child support","candid biographi children famili","gauthier schistl","0"
"8487","just crazi govern  make illeg use old incandesc bulb","energi environ","maribelle linstead","0"
"4522","regard iraq war one said dont go dont your go destabil middl east","debat iraq","saundra baskeyfield","0"
"374","shes vote tax increas hurt middl class small busi","tax","helga cogar","0"
"4250"," mark begich taken campaign cash koch dan sullivan hasnt","campaign financ","ursala ettridge","0"
"3159"," cut gov rick perri administr left teacher without job","educ state budget","olav scurfield","0"
"3089","accord estim agreement panama result almost florida job thefirst year job afterf year","job trade","johannes burry","1"
"3488","refus balanc budget back children","educ","gracie shefton","0"
"2879","whether wrote provis allow aig dole bonus","economi","judye meedendorpe","0"
"7779","obamacar caus million peopl lose current coverag","health care messag machin","margot stoaks","0"
"5373","experienc worst econom recoveri america ever","economi","krisha macfaul","0"
"8647","governor switch posit offshor oil drill","energi environ oil spill","alvie fishleigh","0"
"7100","weve got year studi now show good preschool start your less like public dole your less like prison","children crime educ welfar","quinn wilsone","1"
"2749","iran defens budget billion defens budget closer billion","foreign polici nuclear","wilbur alleburton","1"
"5039"," anthropolog stem scienc technolog engin math field","educ scienc","morey varndell","0"
"1603","texa last th spend mental health care","health care state budget","davin larvor","1"
"9602"," donald trump bankrupt four separ busi","bankruptci candid biographi gambl","milena oakton","1"
"1012"," us rep john barrow d ga celebr gun ownership even face school shoot","gun","baxy pannett","0"
"2568","five citizen kill last week border secur problem","immigr","harmony wittrington","0"
"9133","america never made gut intellig servic bill clinton think former cia director georg tenet word bill clinton gut american intellig","terror","guglielmo barr","0"
"10044","buffett rule  bring less billion per year enough pay one week interest nation debt","deficit feder budget tax","roslyn gregori","1"
"4409","feder law requir resid particip us govern american communiti survey","census economi hous popul","florina mcinteer","1"
"3950","total ad near privat sector job new jersey sinc took offic januari","economi job","valry gregoriou","1"
"9966"," mitt romney million cayman island tax haven","messag machin tax","alla delafoy","1"
"8911","milwauke polic chief can fire offic basic caus","citi govern state budget","jared hutson","0"
"3554"," hillari clinton spent day hospit appear wear glass peopl traumat brain injuri","elect","jarib crippes","0"
"6487","minnesota well elect day registr prove fraudul","elect legal issu state","tiffi marquand","0"
"7734","total state payrol gone total amount number worker state gone like fact bulk just retir","govern effici state budget state financ","saudra ickovicz","0"
"6913","everi billion dollar spend highway construct result job fact averag american sit traffic hour year","transport","shay krier","0"
"7182","senat health care bill leav million peopl without insur coverag","health care","norine samber","1"
"316","report gop insist chang social secur part fiscalcliff fals btw chang support barackobama","feder budget social secur","brandtr reddoch","0"
"9762","borrow cent everi dollar spend","feder budget abc news week","odelle lamperd","1"
"1045","mari burk record fewer job","economi job accomplish job","salomo aspel","0"
"8995","sinc took offic wisconsin rank th nation total busi establish growth compar th year mari burk commerc secretari","economi job accomplish small busi","nerita wessell","1"
"9143"," thom tilli refus  combat isi","militari terror","halsy stroobant","1"
"2330"," austin lowest properti tax rate far five major citi texa","citi budget citi govern hous tax","sean giacobelli","0"
"9698","secretari state ralph molli wrong take credit small busi program","candid biographi small busi","tracie begg","0"
"3693","accord book revel anti christ  man s muslim descent obama","obama birth certif religion","skye ebrall","0"
"147","barack obama never even work busi","candid biographi","shari cromar","0"
"6221"," wisconsin state sen randi hopper r fond du lac alreadi recal","labor state budget","burnaby butting","0"
"8733","support gay marriag","marriag","durante lapthorne","0"
"7518","﻿﻿sinc mayor kennedi obrien took offic sayrevill issu build permit now obrien hold secret meet big develop","elect","andreana sympson","0"
"1608","feder law jare loughner abl buy gun identifi mental ill","gun","deva whitelock","1"
"5831"," your wrong respond assert stop frisk rule unconstitut new york","crime crimin justic suprem court","emilia comiam","0"
"9651","studi rank florida govern corrupt gov rick scott","ethic","rodina musslewhite","0"
"9107","got letter peopl said want money back never gave penni","campaign financ","quinn wilsone","1"
"7031"," presid obama said small busi succeed govern","govern regul infrastructur small busi","josephina huntall","0"
"9129","gun industri isth busi america wholli protect kind liabil","gun legal issu","mahmud pietrzyk","0"
"6036","bill clinton peac dividend cut militari percent","militari","gabriella kellett","0"
"1204","jerseycomeback keep roll thank govchristi nj now lowest corrupt risk state","ethic","danella abad","0"
"7418"," chuck hagel oppos sanction iran","foreign polici","fredericka newart","0"
"9377","unit state largest provid humanitarian assist displac person refuge","foreign polici terror","dex bedwell","1"
"2942","austin mayor candid steve adler admit law firm work koch industri near decad","candid biographi ethic legal issu","gustie prendeguest","1"
"6694"," presid barack obama gone texa mexico border","children foreign polici govern regul immigr","deloris carslake","0"
"784","export use feder loophol decept sell product made cat dog fur us consum","trade","wildon moncaster","1"
"2980"," presid obama never made statement want residu forc left iraq","foreign polici iraq islam terror","nertie lortz","1"
"6223","congress right now best job ever done women feder legislatur still percent","women","mufi baskett","1"
"5145"," chang law carri stop million tax increas dalla school district","educ tax","elias goodday","1"
"4418","member congress requir obamacar obama member administr gold plate health care plan theyr","congress govern regul health care","gwendolin dolder","0"
"5551","percent children african american communiti born wedlock","children divers famili marriag pundit sexual","sheeree gell","1"
"2026","percent gain gone top percent","economi poverti","lizzy douglass","0"
"3455","florida send billion dc return billion","feder budget medicaid state budget tax","bianka learie","1"
"4678","presid obamashealth care law govern takeov healthcar","health care market regul","lyndel gilmartin","0"
"3224","atlanta brave oldest continu oper profession sport franchis america","job accomplish","hildegaard galland","1"
"10017"," donald trump want keep big govern charg feder own land","environ","avram latliff","1"
"3843","ten billion dollar taxpay fund bailout flow straight aig coffer foreign corpor foreign bank","economi","willy fordyce","1"
"1208"," texa rank th nation educ fund per pupil","educ","egon bendall","1"
"1099"," feder govern restrict much salt can put food","food safeti","sacha camamile","0"
"5955"," mitt romney invest creat zero job","candid biographi corpor economi job messag machin","ammamaria flippini","0"
"10217","republican parti lost million regist voter sinc democrat parti lost million regist voter voter registr libertarian parti rose percent","bipartisanship elect","archer markwick","0"
"5558","ron oakley conserv leadership protect local taxpay govern bureaucrat thewat manag district budget decreas percent four year serv board","tax water","nichol banat","0"
"5169","presid bush eight year ad trillion debt presid obama weve ad trillion debt year hes offic","debt","christina prop","1"
"10193","past two year florida cut billion tax","tax","caralie franklen","1"
"5187","mosqu near ground zero","religion","winny chilvers","1"
"3385"," nick rahal vote obama percent time","vote record","archer markwick","0"
"8939","obes kill children per hour","children health care public health","sterne molloy","0"
"4232","social secur doesnt contribut penni deficit","deficit feder budget social secur","nickie yeabsley","0"
"6768","bill bring million properti tax relief typic wisconsin homeown  save approxim four year","state budget tax","gustav adamoli","0"
"6078","instead fight isi saudi focus campaign oust iran back houthi rebel yemen","foreign polici terror","gabe ivashkin","1"
"7653","nevada still state percent white voter","divers elect","lothario de giorgi","0"
"6142","long serv first time everi singl solitari decis requir senat","bipartisanship govern effici","deva whitelock","0"
"4627","newt gingrich propon select presid popular vote instead elector colleg","elect","cairistiona camplen","1"
"9024","veto billion spend lawmak cut tax small busi now texa job creation nation five best hous market right texa balanc five state budget cut state spend","economi hous job accomplish state budget","minetta fraanchyonok","0"
"2531"," judg joann kloppenburg agre use technic give convict sex offend new hear didnt understand charg","crimin justic","misti soar","0"
"1375","franklin roosevelt last presid come congress ask permiss engag war","foreign polici legal issu militari","concordia fannin","0"
"2529","first principl allow fellow like get truck go one end state start point wound point ahead elect night","elect","salomo aspel","1"
"1848","toomey cross parti line stop gun sale suspect terror watch list","gun","paul style","0"
"3734"," ron johnson benefit sever super pac","campaign financ elect","paul style","0"
"5451","human be jail countri today million percent black african american","crime","eberto redman","0"
"3245","presid releas oil strateg oil reserv","energi","liliane kivits","0"
"5889","sinc incid document suction entrap swim pool spas includ death children","children consum safeti","aristotle tofpik","1"
"3987","joe straus receiv percent rate naral nation abort reproduct right action leagu","abort vote record","dyann ferrea","0"
"4175","other place hand heart obama turn back flag slouch","patriot","papagena eardley","0"
"5210","us spend billion research develop energi spend billion oil foreign countri mani enemi","energi foreign polici oil spill","suzann roaf","0"
"8230"," obama new york citi day isra prime minist benjamin netanyahu went tv show instead meet","debat foreign polici israel","eleanora ohanessian","0"
"6636","paula deen support campaign barack obama","pop cultur","mike coldridge","0"
"3312","head head poll general elect beat hillari clinton anybodi point","poll","rosaline harrinson","1"
"3724","oil compani touch million acr alreadi right drill","energi","courtney bandt","0"
"4311","sen obama made argument now critic back novemb","foreign polici","evie staker","0"
"2660","presid label american soft","economi","edouard hundall","0"
"925","lobbyist run campaign","ethic","jesus johanchon","0"
"2160","woman name wisconsin outstand teacher year laid milwauke public school year senior tenur rule elimin act chang","labor","elysee yankishin","0"
"6953","start whole year senior univers illinoi footbal team led team intercept tackl defens back","candid biographi educ sport","annabal durham","0"
"4045","major everi state favor path citizenship undocu immigr","immigr","alexei cadogan","1"
"4400","presid gave auto compani uaw","union","dare ruddiforth","0"
"2853"," berni sander advoc put iranian troop syria tri resolv conflict put right doorstep israel","foreign polici","mirabelle game","1"
"7567"," presid barack obama health care law expect destroy million job","health care","keeley murney","0"
"479"," miami congressman carlo curbelo support drill offshor repeat vote presid obama abil fight pollut combat climat chang","climat chang environ","adelind veighey","0"
"1452","obama vote tax subsidi giveway slow oil compani pursu clean energi sourc","energi","walliw ince","0"
"606","debt ceil fight stock market lost point","economi","zedekiah wraggs","1"
"7472"," chris christi veto equal pay women time let bill pass becam damag campaign issu","incom women worker","binky leemans","0"
"2405","presid barack obama budget threaten nation secur propos armi fewer personnel pearl harbor","feder budget militari","roxy bazylets","0"
"7680"," women need sonogram eighth th week pregnanc get transvagin sonogram","abort health care women","laurent bruinemann","1"
"7665","past legisl session pass legislatur resolut requir congress pass balanc budget amend us constitut","deficit feder budget","evita ringrose","0"
"10090","thirti percent sheldon whitehous campaign money come special interest","campaign financ","josephina huntall","1"
"3020","one ill report raw milk texa four year total six ill occur last year","correct updat food safeti public health","blake rodden","0"
"9345"," cut billion dollar state spend two year","deficit state budget state financ","philippa trevithick","0"
"9023","presid ad close troop last year sinc came offic just hear other ad","afghanistan foreign polici militari abc news week","horatia klulisek","1"
"9491","david beckham soccer stadium get special tax deal let hook million tax everi year year","sport state budget tax","caye jeannesson","1"
"4717","greg abbott defend billion public school fund cut fight hundr school district court","educ state budget state financ","violet macpharlain","0"
"5522","hillari clinton also said unequivoc didnt receiv classifi document","transpar","loise rowlson","0"
"7384","gun epidem lead caus death young african american men next nine caus put togeth","divers gun public health","gayler kettlewell","1"
"8901","buy percent chines export","trade","lonni mclewd","0"
"6562","singl unarm white person shot polic new york year","crime public safeti","austine banbridge","0"
"88","built new prison everi day keep mass incarcer explos nonviol offend","crime crimin justic","portie lilley","1"
"5427"," russ feingold cast decid vote largest tax increas histori","histori job accomplish tax","mozes swyn","0"
"2469","repeal sale tax boat rhode island spawn compani job close billion year sale activ","economi state tax","sigismondo goodbanne","0"
"6602","five member common caus georgia board accept maximum campaign contribut","campaign financ ethic govern regul","chauncey dybald","0"
"10178","texa spend per day hous inmat student","crime crimin justic educ state budget state financ state","harlene atterley","1"
"6773","health care reform bill page outlaw privat insur","corpor health care pundit market regul","ange barlee","0"
"7791","cheney disagre presid bush polici presid bush state repeat intern audienc countri want close guantanamo","militari","barbabra collingdon","0"
"9305","sen rubio worst vote attend record florida senat near year","vote record","henderson greder","1"
"5449","st pete beach local version amend result seem endless lawsuit decim citi legal budget forc citi rais properti tax rate","elect florida amend infrastructur","mellie kertess","0"
"1788","presid obama border patrol border secur deploy border previous presid","immigr","starla tellenbroker","1"
"807","hillari clinton state depart work us corpor pressur haiti rais minimum wage cent hour cent","foreign polici labor worker","sacha camamile","0"
"7102","congress whole less popular sinc poll invent","congress poll","vera rickell","1"
"4779","new provis health care law bar use offlex spend account health save account pay aspirin non prescript health need","health care","bearnard handrock","1"
"4967","overcrowd problem matter fact rhode island one lowest incarcer rate countri","crimin justic","cristian duthie","1"
"2095","rent u haul move compani cost twice much go san francisco austin way around cant find enough truck flee golden state","economi state tourism transport","bartholomew burlay","1"
"9843","obama want increas size govern percent","feder budget","mar houseman","0"
"6549","presid obama work chang medicar wors creat unelect unaccount panel power deni coverag certain treatment","health care medicar","matthiew otteridge","0"
"3335","research watch much crime pick take away footbal","crime","yankee settle","0"
"7846","incom dispar unit state worst sinc s","incom wealth","lazarus bostock","1"
"8661","mitt romney want set date withdraw iraq","iraq","cortney bengochea","0"
"4785","frack wast dump new york state","energi environ","tamma priestman","0"
"4734"," detroit dump bunch sewag lake eri caus big problem ohio","agricultur environ water","aubrey swaffer","0"
"1621"," hillari clinton lie parent name hillari","candid biographi","juan bomb","0"
"6565"," tax rais time eight year becam governor increas part path led wealth job peopl leav state","tax","helaine brooking","0"
"7246","averag time someon use hold share stock back s eight year now averag time four month","corpor economi wealth","jeanelle thalmann","1"
"1431","bill georgia general assembl make presidenti candid meet citizenship requir us constitut","obama birth certif","paddie van eeden","1"
"5784","here someth peopl never talk coach schiano rutger best graduat rate divis footbal program america","educ sport","durante lapthorne","0"
"6634"," mitch mcconnel can happen year senat can becom multi millionair public offic","congress correct updat incom messag machin wealth","valry gregoriou","0"
"7091","record number hispan elect us hous repres","divers elect","colver satchel","1"
"3218"," berni sander auto bailout vote money end save auto industri","congress financi regul vote record","augy arnholdt","0"
"6023"," won popular vote deduct million peopl vote illeg","elect immigr","augy arnholdt","0"
"5723","hous democrat call stimulus stuf astonish million fund prevent program sexual transmit diseas","economi stimulus","gwenni blesli","1"
"5359","tax foundat figur rhode island th highest state state local tax burden per capita countri th worst countri busi tax index rd highest per capita countri tax","economi small busi state financ tax","keenan arrighini","0"
"9725"," reason behind portland high water sewer rate kind pet project unrel core function water sewer bureaus","citi govern govern effici water","linet golden of ireland","0"
"7036","mitt romney  next presid need foreign polici experi","foreign polici","harlene atterley","1"
"838","barack obama vote born aliv legisl illinoi virtual ident feder law","abort","jermaine huban","1"
"3209","countri constitut right like second amend","gun legal issu","gerek newbold","1"
"7195","health insur cost floridian percent","health care","jessie bretherton","0"
"529","everi ethic case result formal sanction there investig subcommitte  establish first","ethic","daria josiah","0"
"680","everi presid sinc franklin delano roosevelt fast track trade author","congress congression rule foreign polici histori trade","merola cobson","0"
"1480"," abraham lincoln tri buy slavesfreedom border state state reject","histori","marnia brasener","1"
"3852","ben carson run presid elimin depend govern doesnt mention grew public school got public hous food stamp got free glass govern program help affirm action got pell grant colleg","candid biographi welfar","corby stichall","0"
"5482","senat accept million campaign contribut financi industri vote allow bankruptci judg modifi home mortgag","bankruptci elect hous","agneta eynaud","1"
"5721","first member congress contribut donald trump","campaign financ candid biographi elect","elinore baniard","1"
"5728","birmingham ala cradl civil right movement","civil right histori","karolina van de vlies","0"
"399"," georgia  send state money per child state charter school budget cut appli charter school","educ","mike kineton","1"
"8207"," indiana governor made record invest educ","educ state budget","philippa trevithick","0"
"3075","rick perri advoc liquid state raini day fund","state budget state financ","theodor logan","0"
"7670","new provis obamacar charg ir implement accord govern account offic","health care tax","jess whyke","1"
"3924","famili pay averag higher premium uncompens care","health care","nora gianilli","0"
"8054","american spend billion billion hour per year compli tax code","financi regul govern regul tax","colman tsarovic","1"
"7477","tuition virginia colleg doubl percent last year","educ","meg candlin","1"
"988","due action presid barack obama burger king nation headquart announc month  pull franchis militari base","corpor govern regul job militari","karolina van de vlies","0"
"1040","sinc right wing extremist incl anti abort anti gov kill american islam extremist","islam terror","gabe ivashkin","0"
"5061","michael dukaki creat job three time faster mitt romney","job","gerek boissier","0"
"2701","properti tax went larg technic colleg portion went percent money put state","tax","nerita wessell","1"
"3801","fastest rise expens us defens depart health care","health care militari","elysee yankishin","1"
"9508","texa law  cant shoot bear second floor window","anim govern regul gun","ivette scandrite","0"
"3565","everi day peopl  arrest possess marijuana georgia","crimin justic drug marijuana","lucila gilhespy","0"
"597","feder reserv polici led percent rise corn price percent rise wheat price percent spike sugar price last year","agricultur energi hunger","quintus tittershill","0"
"5124","romney outsourc call center job india","job messag machin","abagail rushe","0"
"1139"," vote remov common core school","educ","corey godilington","0"
"6097","obama close offshor tax safe haven","economi foreign polici","dorella flag","0"
"7952","went back obes rate exist back s medicar system sever year save much trillion dollar","health care medicar","joseito park","0"
"186","oil rig oper unit state rest world combin","corpor debt economi energi environ feder budget gas price govern regul infrastructur","pepe vause","0"
"9712"," barack obama knew half popul unit state lose health insur","health care","earvin logsdail","0"
"2535"," hillari clinton complet ignor dozen dozen request secur benghazi consul","candid biographi terror","adeline gervaise","0"
"889","us give foreign aid cuba venezuela even though countri enemi","feder budget foreign polici","keri leverson","0"
"8986","compact fluoresc light bulb toxic environment friend","consum safeti energi market regul","vera rickell","0"
"4203","your terrorist cant fli assault weapon can buy","crime gun terror transport","lionel dreye","1"
"8966","georgia public sector employe  condit employ bargain right  work condit","union worker","beverie strickland","0"
"1774","lot cuba surviv depend venezuelan oil money dri","foreign polici","hulda sturgis","1"
"3399","came offic vaccin rate texa percent left two week ago percent","correct updat health care public health","joya pietroni","0"
"1244","near regist sex offend across countri one time unaccount","children crime","petronia fazakerley","0"
"10145","figur cite gov scott walker common use measur job creation","job","suzie kiss","0"
